{
  "format": "foldcanvas-minor-release",
  "version": "1",
  "packageName": "com.foldcanvas.core",
  "packageVersion": "1.1.0",
  "tag": "v1.1.0",
  "stableRelease": true,
  "minorRelease": true,
  "foldScriptVersion": "0.1",
  "unityVersion": "6000.3.20f1",
  "stableBaseline": {
    "packageVersion": "1.0.1",
    "tag": "v1.0.1",
    "tagCommit": "867f3bd5501218aa95872db6e7e66cb213031cab",
    "releaseId": 369729288,
    "publishedAt": "2026-08-13T07:16:56Z",
    "archiveSha256": "4188d23b18b924f6642f9e4eabbc15500fb60fb3d3916f23857a5a19966e1de5",
    "checksumSha256": "2fc1301f537be0a1224242154de870992b7ca13b38bcbf4174bbcebb3dd930b8",
    "manifestSha256": "cabf6b76e61ee96e82978c10213b88f1fa1785ba2b02b9900906ea989b57e54f",
    "evidenceSha256": "deba3003217325eeb0549f367eb98b43bbeb53d62e817b1d22f27a2621e64b7f",
    "assetCount": 4,
    "immutable": true
  },
  "publicRuntimeApi": {
    "assembly": "FoldCanvas.Runtime",
    "signatureCount": 808,
    "normalizedVersionToken": "{PACKAGE_VERSION}",
    "normalizedSha256": "2e63c82335950440c922b7a66a936442498e24ce8dddb539d147007549dfb3ee"
  },
  "productionCorpus": {
    "formatVersion": "1",
    "caseIds": [
      "cyclic-torus",
      "off-grid-fold",
      "planar-artwork",
      "production-cup",
      "registered-wave",
      "sphere-gores"
    ],
    "casesSha256": "15d1bdbc978b73b245a2bb074b5e9ba4f2e354e83adb2da588b667154e9133bd",
    "unchangedCaseIds": [
      "cyclic-torus",
      "planar-artwork",
      "production-cup",
      "registered-wave",
      "sphere-gores"
    ],
    "featureCaseId": "off-grid-fold"
  },
  "publicAssets": [
    "com.foldcanvas.core-1.1.0.evidence.json",
    "com.foldcanvas.core-1.1.0.manifest.json",
    "com.foldcanvas.core-1.1.0.tgz",
    "com.foldcanvas.core-1.1.0.tgz.sha256"
  ],
  "upgrade": {
    "fromPackageVersions": [
      "1.0.1"
    ],
    "fixture": {
      "id": "production-cup",
      "baselinePackageVersion": "1.0.1",
      "baselineGitCommit": "867f3bd5501218aa95872db6e7e66cb213031cab",
      "sourcePath": "Samples~/BootstrapPanel/m12-production-cup.foldcanvas.json",
      "appearancePath": "Samples~/BootstrapPanel/M04ProductionCupCanvas.png",
      "inputFileNames": [
        "M04ProductionCupCanvas.png",
        "m12-production-cup.foldcanvas.json"
      ],
      "sourceRawSha256": "44b3c474784736d5e47d974f94b87c56532db01cffc963330d7ae82b88457fc5",
      "canonicalSourceSha256": "ff9df3d482f1b73820f026093ef3094b0e17f313ebeb26055129af03c41844ff",
      "appearanceSha256": "2b9691733e89987d795e9dcbcd857902f6feb7109540d36fded1b481ded1a383",
      "renderVertices": 2972,
      "topologyVertices": 2562,
      "triangles": 5120,
      "closedVolume": true
    },
    "sourceAuthority": "2d-canvas-plus-foldscript",
    "derivedInputsForbidden": [
      "material",
      "mesh",
      "obj",
      "prefab",
      "receipt",
      "report",
      "screenshot"
    ],
    "unknownVersionsFailClosed": true
  },
  "requiredPrePublicationGates": [
    "clean-install-a",
    "clean-install-b",
    "deterministic-release",
    "exact-head-audit",
    "immutable-release-identities",
    "m13-robustness-long-run",
    "minor-contract",
    "production-corpus",
    "production-handoff-producer",
    "production-handoff-receiver",
    "proof-gallery-repeatability",
    "public-runtime-api",
    "repository-validation",
    "source-upgrade",
    "unity-editmode"
  ],
  "requiredPostPublicationGates": [
    "minor-publication-proof",
    "public-release-assets",
    "public-release-consumer-a",
    "public-release-consumer-b",
    "source-upgrade"
  ],
  "rollback": {
    "packageVersion": "1.0.1",
    "tag": "v1.0.1",
    "gitCommit": "867f3bd5501218aa95872db6e7e66cb213031cab",
    "archiveSha256": "4188d23b18b924f6642f9e4eabbc15500fb60fb3d3916f23857a5a19966e1de5",
    "sourceAuthority": "2d-canvas-plus-foldscript"
  },
  "publication": {
    "githubPrerelease": false,
    "stableMinorRelease": true,
    "externalMarketplace": false
  },
  "escalations": [
    "credentials",
    "external-marketplace-publication",
    "irreversible-permissions",
    "legal-decisions",
    "paid-services"
  ]
}
